{
  "schema_version": "burr.design-data.v1",
  "artifact_id": "linear-actuator-good",
  "artifact_version": "0.1.0",
  "artifact_type": "actuator_mount",
  "rulepack": {
    "path": "builtin:actuator_mount"
  },
  "units": "mm",
  "source": {
    "path": "source.py",
    "sha256": "1cabcb4a8ba9c469891558a8878e17695405fe4f008576ed0ea30aa6563eecf4",
    "size_bytes": 38
  },
  "artifacts": [
    {
      "kind": "step",
      "path": "actuator.step",
      "sha256": "65f910863ef2e52d1a34409b5d0053af79fdf0fb3a3a887202634e716fb717e3",
      "size_bytes": 296
    }
  ],
  "process": {
    "kind": "FDM",
    "material": "PETG",
    "nozzle_mm": 0.4
  },
  "parts": [
    {
      "id": "housing",
      "bbox_mm": {
        "min": [
          -43,
          -24,
          0
        ],
        "max": [
          43,
          24,
          40
        ]
      }
    }
  ],
  "features": [
    {
      "id": "m3_lower_left",
      "part": "housing",
      "kind": "clearance_hole",
      "intent": "mechanical_interface",
      "fastener": "M3",
      "diameter_mm": 3.4,
      "center_mm": [
        40,
        -12,
        12
      ],
      "axis": [
        1,
        0,
        0
      ],
      "role": "loaded_mount"
    }
  ]
}
